<?xml version="1.0" encoding="UTF-8"?>
<xs:schema 
	xmlns:xs="http://www.w3.org/2001/XMLSchema"
	elementFormDefault="qualified">
  <xs:element name="schema">
    <xs:complexType>
      <xs:sequence>
        <xs:element maxOccurs="unbounded" ref="table"/>
      </xs:sequence>
    </xs:complexType>
  </xs:element>
  <xs:element name="table">
    <xs:complexType>
      <xs:sequence>
        <xs:element maxOccurs="unbounded" ref="column"/>
        <xs:element minOccurs="0" maxOccurs="1" ref="primary-key"/>
        <xs:element minOccurs="0" maxOccurs="unbounded" ref="unique-constraint"/>
        <xs:element minOccurs="0" maxOccurs="unbounded" ref="foreign-key"/>
      </xs:sequence>
      <xs:attribute name="name" use="required" type="xs:NCName"/>
    </xs:complexType>
  </xs:element>
  <xs:element name="column">
    <xs:complexType>
      <xs:attribute name="name" use="required" type="xs:NCName"/>
      <xs:attribute name="type" use="required" type="xs:NCName"/>
      <xs:attribute name="size" type="xs:integer"/>
      <xs:attribute name="precision" type="xs:integer"/>
      <xs:attribute name="nullable" type="xs:boolean"/>
    </xs:complexType>
  </xs:element>
  <xs:element name="primary-key">
    <xs:complexType>
      <xs:sequence>
        <xs:element maxOccurs="unbounded" ref="column-ref"/>
      </xs:sequence>
      <xs:attribute name="name" use="required" type="xs:NCName"/>
    </xs:complexType>
  </xs:element>
  <xs:element name="unique-constraint">
    <xs:complexType>
      <xs:sequence>
        <xs:element maxOccurs="unbounded" ref="column-ref"/>
      </xs:sequence>
      <xs:attribute name="name" use="required" type="xs:NCName"/>
    </xs:complexType>
  </xs:element>
  <xs:element name="foreign-key">
    <xs:complexType>
      <xs:sequence>
        <xs:element ref="local-column-ref"/>
        <xs:element ref="foreign-column-ref"/>
      </xs:sequence>
      <xs:attribute name="name" use="required" type="xs:NCName"/>
    </xs:complexType>
  </xs:element>
  <xs:element name="local-column-ref">
    <xs:complexType>
      <xs:attribute name="name" use="required" type="xs:NCName"/>
    </xs:complexType>
  </xs:element>
  <xs:element name="foreign-column-ref">
    <xs:complexType>
      <xs:attribute name="name" use="required" type="xs:NCName"/>
      <xs:attribute name="table" use="required" type="xs:NCName"/>
    </xs:complexType>
  </xs:element>
  <xs:element name="column-ref">
    <xs:complexType>
      <xs:attribute name="name" use="required" type="xs:NCName"/>
    </xs:complexType>
  </xs:element>
</xs:schema>
